{
  "$schema": "http://json-schema.org/draft-07/schema#",
  "$id": "https://schemas.agency-os.com/project_manifest.v1.json",
  "title": "Agency OS Project Manifest",
  "description": "Die zentrale 'Single Source of Truth' (SSoT) für ein Projekt im Agency OS. Sie deklariert Metadaten, Status und Artefakt-Referenzen.",
  "type": "object",
  "properties": {
    "apiVersion": {
      "description": "Die Version der Manifest-Spezifikation.",
      "type": "string",
      "enum": ["agency.os/v1alpha1"]
    },
    "kind": {
      "description": "Die Art der Entität.",
      "type": "string",
      "enum": ["Project"]
    },
    "metadata": {
      "description": "Allgemeine, unveränderliche Metadaten über das Projekt.",
      "type": "object",
      "properties": {
        "projectId": {
          "description": "Eine eindeutige, systemweit generierte UUID für das Projekt.",
          "type": "string",
          "format": "uuid"
        },
        "name": {
          "description": "Der lesbare Name des Projekts.",
          "type": "string"
        },
        "description": {
          "description": "Eine kurze Beschreibung des Projektziels.",
          "type": "string"
        },
        "owner": {
          "description": "Der verantwortliche Agent oder die menschliche Kontaktperson (z.B. E-Mail).",
          "type": "string",
          "format": "email"
        },
        "createdAt": {
          "description": "Der Zeitstempel der Projekterstellung.",
          "type": "string",
          "format": "date-time"
        },
        "lastUpdatedAt": {
          "description": "Der Zeitstempel der letzten Aktualisierung dieses Manifests.",
          "type": "string",
          "format": "date-time"
        }
      },
      "required": ["projectId", "name", "owner", "createdAt"]
    },
    "spec": {
      "description": "Der 'Desired State' (Soll-Zustand) des Projekts, typischerweise aus dem Planning-Framework.",
      "type": "object",
      "properties": {
        "vibe": {
          "description": "Das ursprüngliche VIBE-Objekt (Vision, Intention, etc.).",
          "type": "object"
        },
        "genesis": {
          "description": "Das ursprüngliche GENESIS-Objekt (detaillierte Planung).",
          "type": "object"
        }
      }
    },
    "status": {
      "description": "Der 'Actual State' (Ist-Zustand) des Projekts, der vom Orchestrator verwaltet wird.",
      "type": "object",
      "properties": {
        "projectPhase": {
          "description": "Die aktuelle Phase des Projekts im SDLC.",
          "type": "string",
          "enum": ["PLANNING", "DESIGN", "CODING", "TESTING", "DEPLOYMENT", "MAINTENANCE"]
        },
        "lastUpdate": {
          "description": "Zeitstempel der letzten Statusänderung.",
          "type": "string",
          "format": "date-time"
        },
        "message": {
          "description": "Eine lesbare Nachricht über den aktuellen Status (z.B. 'QA-Tests fehlgeschlagen').",
          "type": "string"
        }
      },
      "required": ["projectPhase"]
    },
    "artifacts": {
      "description": "Ein zentrales Verzeichnis, das auf alle versionierten Artefakte verweist.",
      "type": "object",
      "properties": {
        "planning": {
          "type": "object",
          "properties": {
            "architecture": { "$ref": "#/$defs/artifactLink" }
          }
        },
        "code": {
          "type": "object",
          "properties": {
            "mainRepository": {
              "type": "object",
              "properties": {
                "url": { "type": "string", "format": "uri" },
                "branch": { "type": "string" },
                "lastCommit": { "type": "string" }
              }
            }
          }
        },
        "test": {
          "type": "object",
          "properties": {
            "lastTestPlan": { "$ref": "#/$defs/artifactLink" },
            "lastReport": { "$ref": "#/$defs/artifactLink" }
          }
        },
        "deployment": {
          "type": "object",
          "properties": {
            "lastReceipt": { "$ref": "#/$defs/artifactLink" }
          }
        }
      }
    }
  },
  "required": ["apiVersion", "kind", "metadata", "status", "artifacts"],
  "$defs": {
    "artifactLink": {
      "description": "Eine standardisierte Referenz auf ein Artefakt, versioniert durch einen Git-Commit.",
      "type": "object",
      "properties": {
        "ref": {
          "description": "Der Git-Commit-SHA, der diese Version des Artefakts repräsentiert.",
          "type": "string"
        },
        "path": {
          "description": "Der relative Pfad zum Artefakt (JSON/YAML) innerhalb des Repos.",
          "type": "string"
        },
        "url": {
          "description": "Optionaler direkter URL zu einem extern gespeicherten Artefakt (z.B. S3).",
          "type": "string",
          "format": "uri"
        }
      },
      "required": ["ref", "path"]
    }
  }
}