{
  "apiVersion": "agency.os/v1alpha1",
  "kind": "Project",
  "metadata": {
    "projectId": "vibe-coding-framework-001",
    "name": "VIBE Coding Framework",
    "description": "Framework enabling non-technical users to create robust code specifications similar to Claude Skills but more dynamic and refactorable",
    "owner": "agent@vibe.agency",
    "createdAt": "2025-11-13T00:00:00Z",
    "lastUpdatedAt": "2025-11-14T13:27:00Z"
  },
  "spec": {
    "vibe": {
      "project_type": "commercial",
      "abstraction_level": "FRAMEWORK",
      "target_users": "Non-technical users, product managers, business analysts, entrepreneurs without coding knowledge",
      "core_challenge": "How to build a framework that helps non-coders create professional-grade specifications",
      "inspiration": "Claude Skills, but more robust and dynamic",
      "meta_note": "Meta-test: Using planning framework to build a coding framework"
    },
    "genesis": {}
  },
  "status": {
    "projectPhase": "PLANNING",
    "lastUpdate": "2025-11-14T13:27:00Z",
    "message": "Project initialized. Migrated to v1alpha1 schema."
  },
  "artifacts": {
    "planning": {},
    "code": {},
    "test": {},
    "deployment": {}
  }
}
